{
  "$schema": "https://json-schema.org/draft/2020-12/schema",
  "$id": "https://cornermex.example/schemas/production-activation-request-v1.json",
  "title": "CornerMex Production Activation Request",
  "description": "Declarative, non-executable record of a request to manually activate a Railway production deployment. This schema describes a policy artifact only. It has no deployment capability of its own — see docs/program/DEPLOYMENT_GOVERNANCE.md for the manual activation procedure this record supports.",
  "type": "object",
  "additionalProperties": false,
  "required": [
    "schemaVersion",
    "requestId",
    "founderDecisionId",
    "exactSourceSha",
    "requester",
    "operator",
    "createdAt",
    "expiresAt",
    "maximumEvidenceAgeSeconds",
    "ci",
    "healthEvidence",
    "readinessEvidence",
    "liveGovernanceEvidence",
    "rollbackTarget",
    "rollbackAvailability",
    "expectedProductionService",
    "expectedEnvironment",
    "authorizationStatus",
    "executionStatus"
  ],
  "allOf": [
    {
      "if": {
        "properties": { "rollbackAvailability": { "const": "historical_removed_rebuild_required" } }
      },
      "then": { "required": ["rollbackRebuildPlan"] }
    },
    {
      "if": { "properties": { "rollbackAvailability": { "const": "immediately_redeployable" } } },
      "then": { "required": ["rollbackArtifact"] }
    }
  ],
  "properties": {
    "schemaVersion": { "const": "cornermex-production-activation-request-v1" },
    "requestId": { "type": "string", "pattern": "^PAR-[0-9]{4}-[0-9]{2}-[0-9]{2}-[A-Za-z0-9-]+$" },
    "founderDecisionId": { "type": "string", "pattern": "^FD-CM-[A-Z0-9.-]+$" },
    "exactSourceSha": { "type": "string", "pattern": "^[0-9a-f]{40}$" },
    "requester": { "type": "string", "minLength": 1 },
    "operator": { "type": "string", "minLength": 1 },
    "createdAt": {
      "type": "string",
      "format": "date-time",
      "pattern": "^\\d{4}-\\d{2}-\\d{2}T\\d{2}:\\d{2}:\\d{2}Z$"
    },
    "expiresAt": {
      "type": "string",
      "format": "date-time",
      "pattern": "^\\d{4}-\\d{2}-\\d{2}T\\d{2}:\\d{2}:\\d{2}Z$"
    },
    "ci": {
      "type": "object",
      "additionalProperties": false,
      "required": ["runId", "conclusion", "completedAt", "sourceSha"],
      "properties": {
        "runId": { "type": "integer" },
        "conclusion": { "enum": ["success", "failure", "cancelled", "pending", "unknown"] },
        "completedAt": {
          "type": "string",
          "pattern": "^\\d{4}-\\d{2}-\\d{2}T\\d{2}:\\d{2}:\\d{2}Z$"
        },
        "sourceSha": { "type": "string", "pattern": "^[0-9a-f]{40}$" }
      }
    },
    "maximumEvidenceAgeSeconds": { "type": "integer", "minimum": 1, "maximum": 86400 },
    "healthEvidence": {
      "type": "object",
      "additionalProperties": false,
      "required": ["observedAt", "path", "status"],
      "properties": {
        "observedAt": {
          "type": "string",
          "pattern": "^\\d{4}-\\d{2}-\\d{2}T\\d{2}:\\d{2}:\\d{2}Z$"
        },
        "path": { "const": "/api/health" },
        "status": { "enum": ["ok", "degraded", "unknown"] }
      }
    },
    "readinessEvidence": {
      "type": "object",
      "additionalProperties": false,
      "required": ["observedAt", "path", "status"],
      "properties": {
        "observedAt": {
          "type": "string",
          "pattern": "^\\d{4}-\\d{2}-\\d{2}T\\d{2}:\\d{2}:\\d{2}Z$"
        },
        "path": { "const": "/api/ready" },
        "status": { "enum": ["ok", "degraded", "unknown"] },
        "degradedReason": { "type": "string" }
      }
    },
    "liveGovernanceEvidence": {
      "type": "object",
      "additionalProperties": false,
      "required": ["observedAt", "status", "contractStatus"],
      "properties": {
        "observedAt": {
          "type": "string",
          "pattern": "^\\d{4}-\\d{2}-\\d{2}T\\d{2}:\\d{2}:\\d{2}Z$"
        },
        "status": {
          "enum": [
            "live_governance_verified",
            "live_governance_drift_detected",
            "live_governance_probe_unavailable",
            "live_governance_response_malformed",
            "live_governance_credentials_missing"
          ]
        },
        "contractStatus": {
          "enum": ["railway_live_contract_verified", "railway_live_contract_deferred"]
        }
      }
    },
    "rollbackTarget": { "type": "string", "pattern": "^[0-9a-f]{40}$" },
    "rollbackAvailability": {
      "enum": ["immediately_redeployable", "historical_removed_rebuild_required", "unknown"]
    },
    "rollbackRebuildPlan": {
      "type": "object",
      "additionalProperties": false,
      "required": [
        "reference",
        "exactSourceSha",
        "expectedRecoveryMinutes",
        "tested",
        "testedAt",
        "independentlyVerified",
        "verifiedAt"
      ],
      "properties": {
        "reference": { "type": "string", "minLength": 1 },
        "exactSourceSha": { "type": "string", "pattern": "^[0-9a-f]{40}$" },
        "expectedRecoveryMinutes": { "type": "integer", "minimum": 0 },
        "tested": { "type": "boolean" },
        "testedAt": { "type": "string", "pattern": "^\\d{4}-\\d{2}-\\d{2}T\\d{2}:\\d{2}:\\d{2}Z$" },
        "independentlyVerified": { "type": "boolean" },
        "verifiedAt": {
          "type": "string",
          "pattern": "^\\d{4}-\\d{2}-\\d{2}T\\d{2}:\\d{2}:\\d{2}Z$"
        }
      }
    },
    "rollbackArtifact": {
      "type": "object",
      "additionalProperties": false,
      "required": ["deploymentId", "exactSourceSha", "verifiedAt", "independentlyVerified"],
      "properties": {
        "deploymentId": { "type": "string", "minLength": 1 },
        "exactSourceSha": { "type": "string", "pattern": "^[0-9a-f]{40}$" },
        "verifiedAt": {
          "type": "string",
          "pattern": "^\\d{4}-\\d{2}-\\d{2}T\\d{2}:\\d{2}:\\d{2}Z$"
        },
        "independentlyVerified": { "type": "boolean" }
      }
    },
    "expectedProductionService": { "type": "string", "minLength": 1 },
    "expectedEnvironment": { "const": "production" },
    "authorizationStatus": {
      "enum": [
        "draft",
        "pending_founder_decision",
        "blocked_readiness",
        "blocked_governance",
        "approved_not_executed",
        "expired",
        "cancelled",
        "approved_executed"
      ]
    },
    "executionStatus": {
      "description": "Declarative outcome recorded by an operator; this contract never executes a deployment.",
      "enum": ["not_executed", "executed"]
    }
  }
}
